CUSTOMER SERVICE REPRESENTATIVE-SORTER-SENIOR FILE AUDITOR-CUSTOMER SERVICE-CENTRAL PROCESSING ADMINISTRATOR,50
CUSTOMER SERVICE REPRESENTATIVE-CUSTOMER SERVICE ASSOCIATE-CREW LEADER-HELP DESK AGENT-TECHNICAL CUSTOMER SERVICE REPRESENTATIVE-TARIFF DATABASE ANALYST,100
CUSTOMER SERVICE REPRESENTATIVE-CUSTOMER SERVICE REPRESENTATIVE-INSURANCE SALES CONSULTANT-DATA ENTRY-USED DATA ENTRY-INSURANCE SALES CONSULTANT/CUSTOMER SERVICE-AGENCY ASSISTANT-CUSTOMER SERVICE REPRESENTATIVE-DATA ENTRY-CUSTOMER SERVICE REPRESENTATIVE, 5TH,15
CUSTOMER SERVICE REPRESENTATIVE-CASHIER, AUGUST 2012-UNKNOWN-server,70
CUSTOMER SERVICE REPRESENTATIVE-UNKNOWN-UNKNOWN-MINISTER OF MUSIC / MUSIC DIRECTOR,3
CUSTOMER SERVICE REPRESENTATIVE-CUSTOMER CARE REPRESENTATIVE-EXECUTIVE ASSISTANT TO PASTOR-OFFICE MANAGER/PUBLIC NOTARY-CUSTOMER SERVICE-SUPERVISOR-RECEPTIONIST-ADMINISTRATIVE OFFICE MANAGER-BILINGUAL FRONT DESK RECEPTIONIST,20
CUSTOMER SERVICE REPRESENTATIVE-ANESTHESIA BILLING STUDENT CLERK-COCKTAIL SERVER-OFFICE ASSISTANT-OFFICE ASSISTANT,40
CUSTOMER SERVICE REPRESENTATIVE-CUSTOMER SERVICE REPRESENTATIVE MANAGER GRILL PERSON STOCK CLERK,1
CUSTOMER SERVICE REPRESENTATIVE-CUSTOMER SERVICE REPRESENTATIVE-TIER 1 REPRESENTATIVE-MEDICAL RECORDS CLERK-CSR/PHARMACY TECHNICIAN,89
CUSTOMER SERVICE REPRESENTATIVE-SANDWICH ARTIST/DELIVERY DRIVER-UNKNOWN-TEMP ANNUAL ENROLLMENT SPECIALIST-TATTOO ARTIST-CUSTOMER SERVICE REPRESENTATIVE-UNKNOWN-unknown,3
CUSTOMER SERVICE REPRESENTATIVE-ADMINISTRATIVE ASSISTANT-RECORDS MANAGER-MUSICAL DIRECTOR/PRODUCER-SENIOR CLAIMS EXAMINER-CLAIMS EXAMINER-TECHNICAL ASSISTANT-SECRETARY,9
CUSTOMER SERVICE REPRESENTATIVE-DATA ENTRY CLERK-CUSTOMER SERVICE LEAD-CASHIER/HOSTESS,9
CUSTOMER SERVICE REPRESENTATIVE-ACCOUNT MANAGER-CUSTOMER SERVICE SUPERVISOR-SALES LIAISON-CUSTOMER SERVICE SUPERVISOR-ORDER ENTRY-PARTS ORDER ENTRY,19
CUSTOMER SERVICE REPRESENTATIVE-WRITER-BOOKSELLER-MANAGEMENT,5
CUSTOMER SERVICE REPRESENTATIVE-ADMINISTRATIVE ASSISTANT-CUSTOMER SERVICE SPECIALIST-ADMINISTRATIVE ASSISTANT-CUSTOMER SERVICE REPRESENTATIVE,8